{
  "environmentRawSha256": "b7707a0d4c1d9c7d97f2f6b94941e30b135d26309f2235cf266180f26e3a9a4e",
  "evaluations": [
    {
      "armId": "h0-schema-only",
      "candidateIntegrityHash": "36ff515d77c2d3471ee58dec6243b35ea3262aabd2aaeaea88941ce5ef68ab40",
      "candidateRef": "harness-candidate://pack010-child-run-1",
      "evaluatorVersion": "schema-only-eval-v1",
      "failureCode": null,
      "repetition": 1,
      "status": "ACCEPTED"
    },
    {
      "armId": "h1-reference-grounding",
      "candidateIntegrityHash": "36ff515d77c2d3471ee58dec6243b35ea3262aabd2aaeaea88941ce5ef68ab40",
      "candidateRef": "harness-candidate://pack010-child-run-1",
      "evaluatorVersion": "agent-draft-verifier-v1",
      "failureCode": null,
      "repetition": 1,
      "status": "ACCEPTED"
    },
    {
      "armId": "h0-schema-only",
      "candidateIntegrityHash": "ed6ca325c4763deab5966ac0e70549901c45c3dd9220b4389c6c3438b4031fcd",
      "candidateRef": "harness-candidate://pack010-child-run-2",
      "evaluatorVersion": "schema-only-eval-v1",
      "failureCode": null,
      "repetition": 2,
      "status": "ACCEPTED"
    },
    {
      "armId": "h1-reference-grounding",
      "candidateIntegrityHash": "ed6ca325c4763deab5966ac0e70549901c45c3dd9220b4389c6c3438b4031fcd",
      "candidateRef": "harness-candidate://pack010-child-run-2",
      "evaluatorVersion": "agent-draft-verifier-v1",
      "failureCode": "INVALID_EVIDENCE_CLAIM",
      "repetition": 2,
      "status": "REJECTED"
    },
    {
      "armId": "h0-schema-only",
      "candidateIntegrityHash": "6c20aa911b9e546c6e5c87f3692dda15492ec85d4455c41e2d0e2fe64e3c8c25",
      "candidateRef": "harness-candidate://pack010-child-run-3",
      "evaluatorVersion": "schema-only-eval-v1",
      "failureCode": null,
      "repetition": 3,
      "status": "ACCEPTED"
    },
    {
      "armId": "h1-reference-grounding",
      "candidateIntegrityHash": "6c20aa911b9e546c6e5c87f3692dda15492ec85d4455c41e2d0e2fe64e3c8c25",
      "candidateRef": "harness-candidate://pack010-child-run-3",
      "evaluatorVersion": "agent-draft-verifier-v1",
      "failureCode": null,
      "repetition": 3,
      "status": "ACCEPTED"
    }
  ],
  "evaluatorArms": [
    {
      "armId": "h0-schema-only",
      "evaluatorVersion": "schema-only-eval-v1"
    },
    {
      "armId": "h1-reference-grounding",
      "evaluatorVersion": "agent-draft-verifier-v1"
    }
  ],
  "evaluatorEffects": {
    "connectorCalls": 0,
    "credentialReads": 0,
    "evaluations": 6,
    "externalSideEffects": 0,
    "modelInvocations": 0,
    "networkCalls": 0,
    "productTruthWrites": 0,
    "realUserDataReads": 0,
    "sharedCandidateInputs": 3,
    "toolExecutions": 0
  },
  "graphProtocolVersion": "postgres-graph-terminal-v1",
  "integrityHash": "3294d622073f72c2a8dac57468164eaf489c2ea48d7905bd7c86d8facc22fd8f",
  "integrityProfile": "emergeos-length-prefixed-sha256-v1",
  "packRawSha256": "6be032741abd1a01e2c6dbc93667e6a6977f8ee54d4f7ad10a413c87d8c15ea8",
  "repetitions": [
    {
      "artifactBinding": {
        "contentHash": "e56e5eff7dbb3f55a4f2c5ea22ea92af49c857d650a84bdbfb35940046a3ef95",
        "ordinal": 0,
        "ref": "artifact-version://pack010-artifact-1/1",
        "role": "ARTIFACT"
      },
      "attemptId": "f9941b17bac4bebfcde18d584d8d31b775785bfbca82a8135daf14bbe488a6e1",
      "candidate": {
        "attemptId": "f9941b17bac4bebfcde18d584d8d31b775785bfbca82a8135daf14bbe488a6e1",
        "candidateRef": "harness-candidate://pack010-child-run-1",
        "childRunId": "pack010-child-run-1",
        "childTaskId": "pack010-child-task-1",
        "content": "第1次：参透世界之后，仍然认真生活。🌌",
        "contentHash": "e56e5eff7dbb3f55a4f2c5ea22ea92af49c857d650a84bdbfb35940046a3ef95",
        "evidenceRefs": [
          "capture://pack010-capture"
        ],
        "executionSlotId": "pilot-slot-1",
        "integrityHash": "36ff515d77c2d3471ee58dec6243b35ea3262aabd2aaeaea88941ce5ef68ab40",
        "integrityProfile": "emergeos-length-prefixed-sha256-v1",
        "obtainedEvidenceRefs": [
          "capture://pack010-capture"
        ],
        "outputSchema": "urn:emergeos:schema:internal:agent-draft-proposal:v1",
        "repetition": 1,
        "requiredEvidenceAvailable": true,
        "requiredEvidenceRef": "capture://pack010-capture",
        "schemaVersion": "1.0",
        "sourceRequestOrdinal": 2,
        "sourceResponseHash": "9521b6ab5e99616747a4031a62b908da42bc5c163b10b44f253b638f668fda30",
        "traceRootHash": "e31e69cceab4a72c1a2172c63f3d54b98ec7ea55a15596b2378ccc991aa0a7bd"
      },
      "childRun": {
        "bundle": {
          "checkpointRefs": [],
          "componentVersions": {
            "agent": "agent-draft-service-v1",
            "model-adapter": "openai-responses-protocol-v1",
            "trace-integrity": "emergeos-length-prefixed-sha256-v1",
            "verifier": "agent-draft-verifier-v1"
          },
          "costUsd": 0.000045,
          "environmentSnapshotRef": "environment://sha256:b7707a0d4c1d9c7d97f2f6b94941e30b135d26309f2235cf266180f26e3a9a4e",
          "experiment": {
            "arm": "shared-candidate-live-pilot",
            "repetition": 1
          },
          "failureAttribution": null,
          "handoffRefs": [],
          "harnessVersion": "framework-free-agent-kernel-v1",
          "integrityHash": "49dc0e5ad8c5d0e19b6d36d657d8b5aafeac8b1b1574c6411abadc52cc2a7d81",
          "integrityProfile": "emergeos-length-prefixed-sha256-v1",
          "latencyMs": 40,
          "modelResolved": "gpt-5.6-terra",
          "outcome": "SUCCEEDED",
          "resourceBindings": [
            {
              "contentHash": "519ed7fd7bdae9e11cdb4d2b47edf6ed5c65b371f490cbb7e3fafb2780a36ba3",
              "ordinal": 0,
              "ref": "capture://pack010-capture",
              "role": "EVIDENCE"
            },
            {
              "contentHash": "aab72d3861e743e81e66a94768ab81548767efebc366cdb6b125f5aea19fd606",
              "ordinal": 0,
              "ref": "worker-result://pack010-child-run-1",
              "role": "WORKER_RESULT"
            }
          ],
          "result": {
            "agentVersion": "agent-draft-service-v1",
            "artifactRefs": [],
            "claims": [],
            "costUsd": 0.000045,
            "evidenceRefs": [
              "capture://pack010-capture"
            ],
            "failureReason": null,
            "latencyMs": 40,
            "receiptRefs": [],
            "resolvedModel": "gpt-5.6-terra",
            "runId": "pack010-child-run-1",
            "schemaVersion": "1.0",
            "status": "SUCCEEDED",
            "taskId": "pack010-child-task-1",
            "tokenCount": 45,
            "traceRef": "/api/v1/agent-runs/pack010-child-run-1/trace",
            "uncertainty": [],
            "verifierVersion": "agent-draft-verifier-v1"
          },
          "runId": "pack010-child-run-1",
          "schemaVersion": "1.1",
          "task": {
            "acceptanceChecks": [
              "uses exact synthetic evidence"
            ],
            "allowParallel": false,
            "budgetUsd": 1,
            "capabilityRefs": [
              "capability://worker-handoff/article-draft-read-v1"
            ],
            "contextPolicyVersion": "references-first-v1",
            "dataClass": "PUBLIC",
            "deadlineMs": 5000,
            "delegationChain": [
              "pack010-parent-task-1"
            ],
            "environmentSnapshotRef": "environment://sha256:b7707a0d4c1d9c7d97f2f6b94941e30b135d26309f2235cf266180f26e3a9a4e",
            "evidenceRefs": [],
            "id": "pack010-child-task-1",
            "idempotencyKey": "pack010-request-1",
            "inputRefs": [
              "capture://pack010-capture"
            ],
            "intent": "Create one PUBLIC synthetic draft for repetition 1",
            "kind": "PROPOSE_ARTICLE_DRAFT",
            "latencyClass": "INTERACTIVE",
            "maxModelSteps": 2,
            "maxToolCalls": 1,
            "modalities": [
              "text"
            ],
            "modelProvider": "openai.responses",
            "modelRequested": "gpt-5.6-terra",
            "outputSchema": "urn:emergeos:schema:internal:agent-draft-proposal:v1",
            "parentId": "pack010-parent-task-1",
            "policyVersion": "agent-draft-policy-v1",
            "pricingProfile": "openai-gpt-5.6-terra-pack010-v1",
            "principalRef": "owner-public-synthetic",
            "requiredTools": [
              "capture.read"
            ],
            "returnControlWhen": "return terminal graph truth",
            "risk": "REVERSIBLE",
            "schemaVersion": "1.1",
            "stateVersion": "pack010-state-v1",
            "toolRegistryVersion": "agent-tools-v2",
            "unresolvedDecisions": []
          },
          "taskId": "pack010-child-task-1",
          "tokenCount": 45,
          "toolRegistryVersion": "agent-tools-v2",
          "traceRef": "/api/v1/agent-runs/pack010-child-run-1/trace",
          "traceRootHash": "e31e69cceab4a72c1a2172c63f3d54b98ec7ea55a15596b2378ccc991aa0a7bd",
          "verificationRef": null,
          "workingSelfRef": null
        },
        "completedAt": "2026-07-31T00:00:10.040001Z",
        "startedAt": "2026-07-31T00:00:10.000001Z",
        "terminalHash": "a90b36d5aedb21aac838f492bf4b1d5ca6ca0c3865b206ec29101aacbe7198da"
      },
      "executionSlotId": "pilot-slot-1",
      "manifestHash": "f9941b17bac4bebfcde18d584d8d31b775785bfbca82a8135daf14bbe488a6e1",
      "parentRun": {
        "bundle": {
          "checkpointRefs": [],
          "componentVersions": {
            "agent": "agent-draft-service-v1",
            "trace-integrity": "emergeos-length-prefixed-sha256-v1",
            "verifier": "agent-draft-verifier-v1"
          },
          "costUsd": 0.000045,